{
  "$schema": "http://json-schema.org/draft-07/schema#",
  "title": "ReasonsBase",
  "type": "object",
  "required": ["version", "updatedAt", "reasons"],
  "properties": {
    "version": { "type": "string" },
    "updatedAt": { "type": "string" },
    "sources": { "type": "array", "items": { "type": "string" } },
    "reasons": {
      "type": "array",
      "minItems": 1,
      "items": {
        "type": "object",
        "required": ["id", "title", "weight", "explanation", "actions", "documents", "legalRef"],
        "properties": {
          "id": { "type": "string", "pattern": "^[a-z_]+$" },
          "title": { "type": "string" },
          "weight": { "type": "integer", "minimum": 0 },
          "keywords": { "type": "array", "items": { "type": "string" } },
          "signals": {
            "type": "object",
            "additionalProperties": { "type": "integer" }
          },
          "explanation": { "type": "string" },
          "actions": { "type": "array", "items": { "type": "string" } },
          "documents": { "type": "array", "items": { "type": "string" } },
          "legalRef": { "type": "string" },
          "whereToApply": { "type": "string" }
        }
      }
    }
  }
}