{
  "version": "1.0.0",
  "updatedAt": "2026-09-18",
  "sources": [
    "Постановление Правительства РФ от 16.12.2022 № 2330",
    "ФЗ № 210-ФЗ «Об организации предоставления государственных и муниципальных услуг»",
    "Доклад Уполномоченного при Президенте РФ по правам ребёнка (2024)",
    "Методические материалы СФР по единому пособию"
  ],
  "reasons": [
    {
      "id": "smv_error",
      "title": "Ошибка межведомственного взаимодействия (СМЭВ)",
      "weight": 3,
      "keywords": [
        "неполные данные",
        "не получены сведения",
        "не подтверждено",
        "сведения отсутствуют"
      ],
      "signals": {
        "previousRefusal": 1,
        "refusalTextMatch": 3
      },
      "explanation": "Сведения от другого ведомства не были получены автоматически. По закону ответственность за такие сбои не должна перекладываться на заявителя.",
      "actions": [
        "Запросить в ведомстве справку, подтверждающую сведения",
        "Подать заявление повторно с приложением справки",
        "При повторном отказе — обратиться в СФР письменно со ссылкой на ст. 7 210-ФЗ"
      ],
      "documents": [
        "Справка от ведомства",
        "Копия предыдущего заявления",
        "Копия отказа"
      ],
      "legalRef": "ФЗ № 210-ФЗ, ст. 7; Постановление № 2330",
      "whereToApply": "СФР, МФЦ, «Госуслуги»"
    },
    {
      "id": "income_calc",
      "title": "Некорректный расчёт среднедушевого дохода",
      "weight": 3,
      "keywords": [
        "превышение дохода",
        "превышением среднедушевого дохода",
        "среднедушевой доход",
        "доход выше",
        "расчёт дохода",
        "расчет дохода",
        "превышает прожиточный",
        "величины прожиточного минимума"
      ],
      "signals": {
        "hasIrregularIncome": 2,
        "refusalTextMatch": 3
      },
      "explanation": "В расчёт могли попасть разовые или нерегулярные поступления, которые не должны учитываться (единовременная выплата, возврат налога, продажа имущества).",
      "actions": [
        "Проверить справку о доходах за 12 месяцев",
        "Исключить разовые поступления (при наличии подтверждения)",
        "Подать заявление повторно"
      ],
      "documents": [
        "Справка о доходах",
        "Документ, подтверждающий разовый характер выплаты"
      ],
      "legalRef": "Постановление № 2330, п. 47–49",
      "whereToApply": "СФР, «Госуслуги»"
    },
    {
      "id": "property",
      "title": "Имущественная обеспеченность",
      "weight": 2,
      "keywords": [
        "имущество",
        "квартира",
        "автомобиль",
        "вторая квартира"
      ],
      "signals": {
        "hasExtraProperty": 2,
        "refusalTextMatch": 3
      },
      "explanation": "Учитывается наличие второго жилья, автомобиля и других активов. Для многодетных семей и семей с детьми-инвалидами есть исключения.",
      "actions": [
        "Проверить, попадает ли ваша ситуация под исключение",
        "Подготовить документы, подтверждающие статус",
        "Подать заявление повторно"
      ],
      "documents": [
        "Выписка из ЕГРН",
        "Свидетельство о рождении детей",
        "Справка об инвалидности (при наличии)"
      ],
      "legalRef": "Постановление № 2330, п. 50–52",
      "whereToApply": "СФР, «Госуслуги»"
    },
    {
      "id": "zero_income",
      "title": "Правило нулевого дохода",
      "weight": 2,
      "keywords": [
        "нулевой доход",
        "нет дохода",
        "отсутствие дохода"
      ],
      "signals": {
        "hasNoIncome": 2,
        "refusalTextMatch": 3
      },
      "explanation": "У взрослых членов семьи должен быть доход или уважительная причина его отсутствия. Уважительные причины перечислены в Постановлении № 2330.",
      "actions": [
        "Проверить, попадает ли ваша причина отсутствия дохода под уважительную",
        "Подготовить подтверждающие документы",
        "Подать заявление повторно"
      ],
      "documents": [
        "Справка об уходе за ребёнком",
        "Справка об обучении",
        "Медицинская справка (при наличии)"
      ],
      "legalRef": "Постановление № 2330, п. 53–55",
      "whereToApply": "СФР, «Госуслуги»"
    },
    {
      "id": "documents",
      "title": "Неполный комплект документов",
      "weight": 2,
      "keywords": [
        "неполные данные",
        "не представлены документы",
        "отсутствуют сведения",
        "не приложены"
      ],
      "signals": {
        "missingDocs": 2,
        "refusalTextMatch": 3
      },
      "explanation": "В заявлении не хватает сведений или документов, которые заявитель должен предоставить самостоятельно.",
      "actions": [
        "Проверить перечень обязательных документов",
        "Донести недостающие документы",
        "Подать заявление повторно"
      ],
      "documents": [
        "Перечень зависит от конкретной ситуации"
      ],
      "legalRef": "Постановление № 2330, п. 24–26",
      "whereToApply": "СФР, МФЦ, «Госуслуги»"
    },
    {
      "id": "employment_status",
      "title": "Некорректный статус занятости",
      "weight": 2,
      "keywords": [
        "статус занятости",
        "не трудоустроен",
        "самозанятый",
        "ип"
      ],
      "signals": {
        "selfEmployed": 2,
        "refusalTextMatch": 3
      },
      "explanation": "Для самозанятых и ИП действуют отдельные правила учёта дохода. Иногда требуется подтверждение фактической деятельности.",
      "actions": [
        "Проверить, как учтён ваш статус в заявлении",
        "Подготовить справку о доходах от самозанятости / ИП",
        "Подать заявление повторно"
      ],
      "documents": [
        "Справка о доходах",
        "Выписка из ФНС"
      ],
      "legalRef": "Постановление № 2330, п. 47–49",
      "whereToApply": "СФР, ФНС, «Госуслуги»"
    },
    {
      "id": "child_age",
      "title": "Несоответствие возраста ребёнка",
      "weight": 2,
      "keywords": [
        "возраст",
        "старше",
        "до 17 лет",
        "не соответствует"
      ],
      "signals": {
        "childAgeIssue": 2,
        "refusalTextMatch": 3
      },
      "explanation": "Единое пособие назначается на детей до 17 лет. Если ребёнку исполнилось 17, выплата прекращается, но можно оформить другие меры поддержки.",
      "actions": [
        "Проверить возраст ребёнка на дату подачи",
        "При необходимости — оформить другие меры поддержки",
        "Обратиться в СФР за разъяснением"
      ],
      "documents": [
        "Свидетельство о рождении ребёнка"
      ],
      "legalRef": "ФЗ № 81-ФЗ; Постановление № 2330",
      "whereToApply": "СФР, «Госуслуги»"
    },
    {
      "id": "citizenship",
      "title": "Вопросы гражданства и статуса пребывания",
      "weight": 3,
      "keywords": [
        "гражданство",
        "статус",
        "пребывание",
        "вид на жительство"
      ],
      "signals": {
        "nonCitizen": 2,
        "refusalTextMatch": 3
      },
      "explanation": "Единое пособие доступно гражданам РФ, а также отдельным категориям иностранных граждан с постоянным проживанием. Временное пребывание может быть основанием для отказа.",
      "actions": [
        "Проверить свой статус пребывания",
        "Подготовить документы, подтверждающие право на выплату",
        "Обратиться в СФР за разъяснением"
      ],
      "documents": [
        "Вид на жительство",
        "Разрешение на временное проживание",
        "Паспорт"
      ],
      "legalRef": "ФЗ № 81-ФЗ, ст. 1; Постановление № 2330",
      "whereToApply": "СФР, МВД, «Госуслуги»"
    },
    {
      "id": "duplicate_application",
      "title": "Дублирующее заявление",
      "weight": 1,
      "keywords": [
        "дублирующее",
        "повторное",
        "уже назначено",
        "уже подано"
      ],
      "signals": {
        "previousApplication": 1,
        "refusalTextMatch": 3
      },
      "explanation": "Заявление уже находится в обработке или выплата уже назначена. Повторная подача не требуется.",
      "actions": [
        "Проверить статус предыдущего заявления в личном кабинете",
        "Дождаться решения",
        "При необходимости — обратиться в СФР"
      ],
      "documents": [
        "Номер предыдущего заявления"
      ],
      "legalRef": "Постановление № 2330",
      "whereToApply": "«Госуслуги», СФР"
    },
    {
      "id": "death_or_deprivation",
      "title": "Прекращение права на выплату",
      "weight": 2,
      "keywords": [
        "лишение родительских прав",
        "смерть",
        "прекращение"
      ],
      "signals": {
        "rightsTerminated": 2,
        "refusalTextMatch": 3
      },
      "explanation": "Право на пособие прекращается при лишении родительских прав, смерти ребёнка или родителя, а также в других случаях, установленных законом.",
      "actions": [
        "Проверить основание прекращения права",
        "Обратиться в СФР за письменным разъяснением",
        "При необходимости — обжаловать в вышестоящем органе"
      ],
      "documents": [
        "Документы, подтверждающие изменение статуса"
      ],
      "legalRef": "ФЗ № 81-ФЗ; Постановление № 2330",
      "whereToApply": "СФР"
    },
    {
      "id": "other",
      "title": "Иная причина",
      "weight": 0,
      "keywords": [
        "другое",
        "иное",
        "не указано",
        "не понятно"
      ],
      "signals": {},
      "explanation": "Формулировка отказа не позволяет однозначно определить причину. Рекомендуется запросить письменное разъяснение в СФР.",
      "actions": [
        "Запросить письменное разъяснение причины отказа в СФР",
        "При необходимости — обратиться в прокуратуру"
      ],
      "documents": [
        "Письменный запрос в СФР"
      ],
      "legalRef": "ФЗ № 210-ФЗ, ст. 11",
      "whereToApply": "СФР, прокуратура"
    }
  ]
}
